{
  "idempotency_key": "j:0d6f1c1e-2a5b-4c8e-9f10-2b3c4d5e6f70:v3:u:7b1e8a2c-5d4f-4a6b-8c9d-0e1f2a3b4c5d:n:4:e:9a8b7c6d-5e4f-4a3b-8c2d-1e0f9a8b7c6d",
  "message_id": "b3f2a1c0-9e8d-4c7b-a6f5-4e3d2c1b0a99",
  "channel": "kakao_alimtalk",
  "connector": { "id": "kakao_alimtalk_nhn", "version": "0.1.0", "credential_ref": "cred:kakao_alimtalk_nhn:prod" },
  "user_id": "7b1e8a2c-5d4f-4a6b-8c9d-0e1f2a3b4c5d",
  "target": {
    "type": "phone",
    "endpoint_id": "9a8b7c6d-5e4f-4a3b-8c2d-1e0f9a8b7c6d",
    "value": "+821012345678",
    "platform": null,
    "country": "KR"
  },
  "content": {
    "template": {
      "code": "ORDER_SHIPPED_01",
      "variables": { "고객명": "홍길동", "주문번호": "A20260902-0017", "택배사": "CJ대한통운" },
      "sender_key": "5f1e2d3c4b5a69788776655443322110aabbccdd"
    },
    "buttons": [
      { "type": "web_link", "name": "배송 조회", "url_mobile": "https://shop.example.com/orders/A20260902-0017" }
    ]
  },
  "category": "transactional",
  "consent": { "basis": "transactional", "opted_in_at": null, "source": "order" },
  "policy": { "quiet_hours": "bypassed_transactional", "frequency_cap": "bypassed_transactional", "ad_label_required": false, "unsubscribe_ref": null },
  "locale": "ko-KR",
  "options": { "ttl_seconds": 3600, "priority": "normal" },
  "fallback": [
    {
      "channel": "sms",
      "connector": { "id": "sms_nhn", "version": "0.1.0", "credential_ref": "cred:sms_nhn:prod" },
      "target": { "type": "phone", "endpoint_id": "9a8b7c6d-5e4f-4a3b-8c2d-1e0f9a8b7c6d", "value": "+821012345678", "country": "KR" },
      "content": { "text": { "body": "[넛지온샵] 홍길동님의 주문 A20260902-0017이 CJ대한통운으로 발송되었습니다. 배송 조회: https://shop.example.com/o/17", "sender": "0212345678" } },
      "on": ["invalid_target", "permanent_content", "retry_exhausted", "unsupported"]
    }
  ],
  "journey_id": "0d6f1c1e-2a5b-4c8e-9f10-2b3c4d5e6f70",
  "journey_version": 3,
  "node_index": 4,
  "campaign_ref": null,
  "metadata": { "order_id": "A20260902-0017" }
}
